{
  "id": "qwen3-vl-8b-instruct-q4-k-m",
  "role": "chat",
  "label": "Qwen3 VL 8B Instruct",
  "license": "Apache-2.0",
  "engine": "llama-server",
  "implemented": true,
  "quality_tier": "standard",
  "download": {
    "url": "https://huggingface.co/Qwen/Qwen3-VL-8B-Instruct-GGUF/resolve/f982a07559d4a2f6c8744d840bf6fccab30eea96/Qwen3VL-8B-Instruct-Q4_K_M.gguf",
    "sha256": "67d1659bfe71b89d50b45a4ad1a9e5b997e5bb16ce5da66a6a6167abd569e9e2",
    "approx_bytes": 5027784800
  },
  "image_input": {
    "projector": {
      "file": "mmproj-Qwen3VL-8B-Instruct-Q8_0.gguf",
      "download": {
        "url": "https://huggingface.co/Qwen/Qwen3-VL-8B-Instruct-GGUF/resolve/f982a07559d4a2f6c8744d840bf6fccab30eea96/mmproj-Qwen3VL-8B-Instruct-Q8_0.gguf",
        "sha256": "c6ba85508d82f42590e6eb77d5340369ab6fecf107a7561d809523d8aa5f3bfd",
        "approx_bytes": 752289728
      }
    }
  },
  "thinking_mode": "none",
  "sizing": {
    "kind": "transformer_gguf",
    "param_count_billion": 8.8,
    "bits_per_weight": 4,
    "gguf_overhead_fraction": 0.1,
    "num_layers": 36,
    "num_kv_heads": 8,
    "head_dim": 128,
    "max_context": 262144
  }
}
