{
  "id": "qwen3-vl-4b-instruct-q4-k-m",
  "role": "vision",
  "label": "Qwen3 VL 4B Instruct",
  "license": "Apache-2.0",
  "engine": "llama-server",
  "implemented": true,
  "quality_tier": "standard",
  "download": {
    "url": "https://huggingface.co/Qwen/Qwen3-VL-4B-Instruct-GGUF/resolve/1cd86afb9a95c410a6038ab3b40d8b578c892266/Qwen3VL-4B-Instruct-Q4_K_M.gguf",
    "sha256": "66358cb18bb6b3b1b6675aa412c7a88ef01d228f481184d13668e5201c730a0a",
    "approx_bytes": 2497281664
  },
  "image_input": {
    "projector": {
      "file": "mmproj-Qwen3VL-4B-Instruct-Q8_0.gguf",
      "download": {
        "url": "https://huggingface.co/Qwen/Qwen3-VL-4B-Instruct-GGUF/resolve/1cd86afb9a95c410a6038ab3b40d8b578c892266/mmproj-Qwen3VL-4B-Instruct-Q8_0.gguf",
        "sha256": "30ba2c7dd3127a4561b6cba9d13d0f711c91bdb38742e2f56d73c8cb596bd06d",
        "approx_bytes": 453974304
      }
    }
  },
  "sizing": {
    "kind": "transformer_gguf",
    "param_count_billion": 4.4,
    "bits_per_weight": 4,
    "gguf_overhead_fraction": 0.1,
    "num_layers": 36,
    "num_kv_heads": 8,
    "head_dim": 128,
    "max_context": 262144
  }
}
