{
  "id": "rerank-role-example",
  "role": "rerank",
  "label": "Rerank Role Example",
  "license": "Apache-2.0",
  "engine": "llama-server",
  "implemented": true,
  "quality_tier": "standard",
  "tags": [
    "recommended",
    "fast"
  ],
  "pros": [
    "Runs well on a single 8GB GPU",
    "Fast replies"
  ],
  "cons": [
    "Less capable than a larger model on hard reasoning tasks"
  ],
  "sizing": {
    "kind": "transformer_gguf",
    "param_count_billion": 8.2,
    "bits_per_weight": 4,
    "gguf_overhead_fraction": 0.1,
    "num_layers": 36,
    "num_kv_heads": 8,
    "head_dim": 128,
    "max_context": 32768
  },
  "turn_budget": {
    "rounds": 1,
    "tools_offered": [
      "recall",
      "remember",
      "remind",
      "timer",
      "weather",
      "websearch"
    ],
    "always_search": true,
    "model_transitions": true,
    "context_tokens": 4000,
    "thinking_budget_tokens": 0,
    "thinking_budget_tokens_toggled": 512,
    "thinking_for_minors": false,
    "reply_ceiling_tokens": 1536,
    "deadlines_ms": {
      "model": 20000,
      "tool": 10000,
      "total": 45000
    },
    "measured": {
      "false_call_rate": 0,
      "inverse_miss_rate": 0.62,
      "rewrite_pass_rate": 0,
      "on": "ARCH-MEASURE-01 tool-calling bench, 2026-09-22, 50 repeats (0 false calls in 50, 19 fitting searches in 50); rewrite_pass_rate not yet measured for this model, recorded 0 pending the query-rewrite bench"
    }
  }
}
